<!--Ya que necesitamos el archivo actividad2.dtd, tenemos que marcar 'no' en 'standalone'. Aunque si no lo hubiese escrito, el valor por defecto hubiera sido el mismo-->
<?xml version="1.0" encoding="UTF-8" standalone="no"?>
<!--Para enlazar con un archivo dtd externo incluiremos el nombre del archivo en el -->
<!DOCTYPE clientes SYSTEM "actividad2.dtd">
<clientes>
	<cliente>
		<codigo_cliente>E1234</codigo_cliente>
		<!--Ya que no importa el orden de los campos nombre_via, num_via,..., serán atributos-->
		<direccion nombre_via="Calle Romero" num_via="1" 
		localidad = "Córdoba" provincia ="Córdoba" 
		cod_postal="14003"></direccion>
		<telefono>957520744</telefono>
		<tipo_cliente>
			<empresa>
				<nombre_apellidos>Juan Ramírez Sánchez</nombre_apellidos>
				<razon_social>Restaurante Pepe de la Judería</razon_social>
				<web></web>
				<CIF>b14978647</CIF>
			</empresa>
		</tipo_cliente>	
		<factura>
			<fecha>19/01/2022</fecha>
			<num_factura>EMP-22-1234</num_factura>
			<forma_pago>Efectivo</forma_pago>
			<fecha_vencimiento>28 días</fecha_vencimiento>
			<producto>
				<cantidad>30</cantidad>
				<nombre_producto>Parqueoliva Serie OrO</nombre_producto>
				<cod_producto>PAR-SER-ORO</cod_producto>
				<precio_unitario>12.00</precio_unitario>
			</producto>
			<producto>
				<cantidad>12</cantidad>
				<nombre_producto>Rincón de la Subbética</nombre_producto>
				<cod_producto>RIN-CON-SUB</cod_producto>
				<precio_unitario>18.95</precio_unitario>
			</producto>
			<producto>
				<cantidad>10</cantidad>
				<nombre_producto>La joya del Monte</nombre_producto>
				<cod_producto>JOY-DEL-MON</cod_producto>
				<precio_unitario>69.95</precio_unitario>
			</producto>
			<cuantia>
				<subtotal>1286.90</subtotal>
				<iva>21</iva>
				<total>1557.15</total>
			</cuantia>
		</factura>
	</cliente>
</clientes>
	
	

